{
  "$schema": "http://json-schema.org/draft-07/schema#",
  "title": "VCSDD Coherence Graph",
  "description": "Conditioned Evidence Graph (CEG) storing dependency relationships between spec documents in a VCSDD feature pipeline.",
  "type": "object",
  "required": ["version", "nodes", "edges", "lastScanAt"],
  "additionalProperties": false,
  "properties": {
    "version": {
      "type": "integer",
      "const": 1,
      "description": "Schema version; always 1 for this format."
    },
    "nodes": {
      "type": "object",
      "description": "Map of node_id -> node data.",
      "additionalProperties": {
        "$ref": "#/$defs/node"
      }
    },
    "edges": {
      "type": "array",
      "description": "Directed dependency edges with evidence-based confidence scores.",
      "items": {
        "$ref": "#/$defs/edge"
      }
    },
    "lastScanAt": {
      "type": "string",
      "description": "ISO 8601 timestamp of the last frontmatter scan."
    }
  },
  "$defs": {
    "node": {
      "type": "object",
      "required": ["id", "type"],
      "additionalProperties": false,
      "properties": {
        "id": {
          "type": "string",
          "minLength": 1,
          "description": "Unique node identifier, e.g. 'design:api-design'."
        },
        "type": {
          "type": "string",
          "description": "Semantic type of the node, e.g. 'design', 'requirement', 'file'."
        },
        "placeholder": {
          "type": "boolean",
          "description": "True when a node was auto-created (e.g. by addEdge) without corresponding scanned frontmatter; false when created from scanned frontmatter."
        },
        "path": {
          "type": "string",
          "description": "Relative file path within the feature directory."
        },
        "name": {
          "type": "string",
          "description": "Human-readable display name."
        },
        "module": {
          "type": "string",
          "description": "Optional module grouping."
        }
      }
    },
    "edge": {
      "type": "object",
      "required": ["id", "sourceId", "targetId", "relation", "semantic", "confidence", "isActive", "evidence"],
      "additionalProperties": false,
      "properties": {
        "id": {
          "type": "integer",
          "minimum": 1,
          "description": "Auto-incrementing integer ID."
        },
        "sourceId": {
          "type": "string",
          "description": "ID of the node that depends on targetId."
        },
        "targetId": {
          "type": "string",
          "description": "ID of the node being depended upon."
        },
        "relation": {
          "type": "string",
          "description": "Semantic relationship type, e.g. 'derives_from', 'specifies', 'imports'."
        },
        "semantic": {
          "type": "string",
          "enum": ["governance", "structural", "behavioral", "technical", "validation"],
          "description": "High-level semantic category of the dependency."
        },
        "confidence": {
          "type": "number",
          "minimum": 0,
          "maximum": 1,
          "description": "Noisy-OR aggregated confidence score."
        },
        "isActive": {
          "type": "boolean",
          "description": "Soft-delete flag; inactive edges are ignored during traversal."
        },
        "evidence": {
          "type": "array",
          "description": "Evidence items that contribute to the confidence score.",
          "items": {
            "$ref": "#/$defs/evidence"
          }
        },
        "condition": {
          "type": "string",
          "description": "Optional activation condition text."
        }
      }
    },
    "evidence": {
      "type": "object",
      "required": ["sourceType", "method", "score", "isNegative"],
      "additionalProperties": false,
      "properties": {
        "sourceType": {
          "type": "string",
          "enum": ["frontmatter", "static", "framework", "inferred", "human", "dynamic", "history"],
          "description": "Origin of this evidence item. 'human' and 'dynamic' survive purge; others are regenerated on scan."
        },
        "method": {
          "type": "string",
          "description": "How this evidence was extracted, e.g. 'frontmatter', 'ast_import', 'convention'."
        },
        "score": {
          "type": "number",
          "minimum": 0,
          "maximum": 1,
          "description": "Probability contribution for Noisy-OR calculation."
        },
        "detail": {
          "type": "string",
          "description": "Optional human-readable description of the evidence."
        },
        "isNegative": {
          "type": "boolean",
          "description": "When true, this evidence acts as counter-evidence, reducing confidence."
        }
      }
    }
  }
}
